,Date of rally,City,State,Venue,Other speakers,Source,concatAddress,location,point,finalAddress,latitude,longitude,altitude
84,"Friday, December 8, 2017",Pensacola,FL,Pensacola Bay Center,,[19],"Pensacola, FL","Pensacola, Escambia County, Florida, United States of America","(30.421309, -87.2169149, 0.0)","Pensacola, Escambia County, Florida, United States of America",30.421309,-87.2169149,0.0
85,"Monday, February 11, 2019",El Paso,TX,El Paso County Coliseum,"Brad Parscale, John Cornyn, Lance Berkman, Ted Cruz, Donald Trump Jr.",[76],"El Paso, TX","El Paso, El Paso County, Texas, United States of America","(31.7754152, -106.4646348, 0.0)","El Paso, El Paso County, Texas, United States of America",31.7754152,-106.4646348,0.0
86,"Thursday, March 28, 2019",Grand Rapids,MI,Van Andel Arena,"Donald Trump Jr., Brad Parscale",[77],"Grand Rapids, MI","Grand Rapids, Kent County, Michigan, United States of America","(42.9632405, -85.6678639, 0.0)","Grand Rapids, Kent County, Michigan, United States of America",42.9632405,-85.6678639,0.0
87,"Saturday, April 27, 2019",Green Bay,WI,Resch Center,"Mike Gallagher, Diamond and Silk, Sean Duffy, Donald Trump Jr., Sarah Sanders",[78],"Green Bay, WI","Green Bay, Brown County, Wisconsin, United States of America","(44.5126379, -88.0125794, 0.0)","Green Bay, Brown County, Wisconsin, United States of America",44.5126379,-88.0125794,0.0
88,"Wednesday, May 8, 2019[79]",Panama City Beach,FL,Aaron Bessant Park Amphitheater,"Ron DeSantis, Marco Rubio",[80][81],"Panama City Beach, FL","Panama City Beach, Bay County, Florida, United States of America","(30.1765914, -85.8054879, 0.0)","Panama City Beach, Bay County, Florida, United States of America",30.1765914,-85.8054879,0.0
89,"Monday, May 20, 2019",Montoursville,PA,Williamsport Regional Airport,Fred Keller,[82],"Montoursville, PA","Montoursville, Lycoming County, Pennsylvania, United States of America","(41.2552213, -76.9128928, 0.0)","Montoursville, Lycoming County, Pennsylvania, United States of America",41.2552213,-76.9128928,0.0
90,"Thursday, December 1, 2016",Cincinnati,OH,U.S. Bank Arena,"Josh Mandel, Stephen Miller, Matt Bevin, Mike Pence",[1],"Cincinnati, OH","Cincinnati, Hamilton County, Ohio, United States of America","(39.1014537, -84.5124602, 0.0)","Cincinnati, Hamilton County, Ohio, United States of America",39.1014537,-84.5124602,0.0
91,"Tuesday, December 6, 2016",Fayetteville,NC,Crown Coliseum,"Jimmy Dixon, Nat Robertson, Cherie Berry, Robert Pittenger, Diamond and Silk, Jim Mattis",[2],"Fayetteville, NC","Fayetteville, North Carolina, United States of America","(35.0525759, -78.878292, 0.0)","Fayetteville, North Carolina, United States of America",35.0525759,-78.878292,0.0
92,"Thursday, December 8, 2016",Des Moines,IA,Iowa Events Center,Mike Pence,[3],"Des Moines, IA","Des Moines, Polk County, Iowa, United States of America","(41.5910641, -93.6037149, 0.0)","Des Moines, Polk County, Iowa, United States of America",41.5910641,-93.6037149,0.0
93,"Friday, December 9, 2016",Baton Rouge,LA,"Dow Chemical Hangar, Baton Rouge Metropolitan Airport","Jeff Landry, Bodi White, Billy Nungesser, Ralph Abraham, Garret Graves, Phil Bryant, David Vitter, Clay Higgins, John Kennedy",[4],"Baton Rouge, LA","Baton Rouge, East Baton Rouge Parish, Louisiana, United States of America","(30.4459596, -91.18738, 0.0)","Baton Rouge, East Baton Rouge Parish, Louisiana, United States of America",30.4459596,-91.18738,0.0
94,"Friday, December 9, 2016",Grand Rapids,MI,DeltaPlex Arena,"Ronna McDaniel, Bill Huizenga, Betsy DeVos",[5],"Grand Rapids, MI","Grand Rapids, Kent County, Michigan, United States of America","(42.9632405, -85.6678639, 0.0)","Grand Rapids, Kent County, Michigan, United States of America",42.9632405,-85.6678639,0.0
95,"Tuesday, December 13, 2016",West Allis,WI,"Wisconsin Exposition Center, Wisconsin State Fair Park","Brad Courtney, David Clarke, Sean Duffy, Ron Johnson, Reince Priebus, Scott Walker, Paul Ryan, Mike Pence",[6],"West Allis, WI","West Allis, Wisconsin, United States of America","(43.0166806, -88.0070315, 0.0)","West Allis, Wisconsin, United States of America",43.0166806,-88.0070315,0.0
96,"Thursday, December 15, 2016",Hershey,PA,Giant Center,Mike Pence,[7],"Hershey, PA","Hershey, Dauphin County, Pennsylvania, 17033-1712, United States of America","(40.2854881, -76.6506001, 0.0)","Hershey, Dauphin County, Pennsylvania, 17033-1712, United States of America",40.2854881,-76.6506001,0.0
97,"Friday, December 16, 2016",Orlando,FL,Central Florida Fairgrounds,"Blaise Ingoglia, Dennis A. Ross, Neal Dunn, Sharon Day, Rick Scott, Mike Pence",[8],"Orlando, FL","Orlando, Orange County, Florida, United States of America","(28.5421109, -81.3790304, 0.0)","Orlando, Orange County, Florida, United States of America",28.5421109,-81.3790304,0.0
98,"Saturday, December 17, 2016",Mobile,AL,Ladd–Peebles Stadium,"Jim Carns, Ed Henry, Perry O. Hooper Jr., Bradley Byrne, Robert Aderholt, Terry Lathan, Tom Parker, Kay Ivey, Luther Strange, Franklin Graham, Stephen Miller, Kellyanne Conway, Jeff Sessions, Hope Hicks",[9],"Mobile, AL","Mobile, Mobile County, Alabama, United States of America","(30.6943566, -88.0430541, 0.0)","Mobile, Mobile County, Alabama, United States of America",30.6943566,-88.0430541,0.0
